{
  "$schema": "https://decantr.ai/schemas/blueprint.v1.json",
  "id": "registry-platform",
  "version": "1.0.0",
  "decantr_compat": ">=2.0.0",
  "name": "Registry Platform",
  "description": "Content registry with browsing, publishing, user management, team collaboration, and admin moderation. Dogfooded UI for the Decantr design intelligence platform.",
  "blueprint_portfolio": {
    "visibility": "featured",
    "maturity": "certified-flagship",
    "rationale": "Flagship blueprint with a maintained showcase capsule, thumbnail asset, and smoke-green shortlist verification suitable for first-run discovery.",
    "artifact": {
      "status": "certified",
      "showcase": "registry-platform",
      "notes": "Certified Artifact Contract V0: showcase capsule plus shortlist verification report are available in the Decantr monorepo."
    }
  },
  "tags": [
    "registry",
    "platform",
    "dashboard",
    "content-management",
    "moderation",
    "billing"
  ],
  "compose": [
    "registry-browser",
    "user-dashboard",
    "admin-moderation",
    {
      "archetype": "auth-gateway",
      "prefix": "auth",
      "role": "gateway"
    }
  ],
  "theme": {
    "id": "luminarum",
    "mode": "dark",
    "shape": "pill"
  },
  "personality": "Vibrant design intelligence registry. Warm coral and amber accents on a rich dark canvas (or crisp warm-white in light mode). Content cards are the hero — outlined with colored type borders, hovering with purpose. Search is instant and faceted. Publishing feels like sharing art. The Decantr dogfood app — built with its own system, proudly showing what the platform produces. Think Figma Community meets shadcn/ui registry.",
  "voice": {
    "tone": "Welcoming and developer-friendly. Uses design-system terminology naturally. Celebrates community contributions.",
    "cta_verbs": [
      "Browse",
      "Publish",
      "Install",
      "Preview",
      "Fork",
      "Explore"
    ],
    "avoid": [
      "Submit",
      "Click here",
      "Please enter",
      "Buy now",
      "Amazing"
    ],
    "empty_states": "Encouraging and constructive. Empty content list links to publishing guide. No results suggests broadening filters or browsing popular items.",
    "errors": "Precise with error codes and affected resource IDs. Validation errors quote the failing field.",
    "loading": "Content card skeletons with type-colored top borders. Registry stats use counter animations. Search results stream in as they resolve."
  },
  "features": [
    "search",
    "pagination",
    "auth",
    "api-keys",
    "validation",
    "admin",
    "team",
    "billing",
    "theme-toggle"
  ],
  "routes": {
    "/": {
      "page": "homepage",
      "shell": "top-nav-main",
      "archetype": "registry-browser"
    },
    "/browse": {
      "page": "browse",
      "shell": "top-nav-main",
      "archetype": "registry-browser"
    },
    "/browse/:type": {
      "page": "browse-type",
      "shell": "top-nav-main",
      "archetype": "registry-browser"
    },
    "/:type/:namespace/:slug": {
      "page": "detail",
      "shell": "top-nav-main",
      "archetype": "registry-browser"
    },
    "/profile/:username": {
      "page": "profile",
      "shell": "top-nav-main",
      "archetype": "registry-browser"
    },
    "/login": {
      "page": "login",
      "shell": "centered",
      "archetype": "auth-gateway"
    },
    "/dashboard": {
      "page": "overview",
      "shell": "sidebar-main",
      "archetype": "user-dashboard"
    },
    "/dashboard/content": {
      "page": "content",
      "shell": "sidebar-main",
      "archetype": "user-dashboard"
    },
    "/dashboard/content/new": {
      "page": "content-new",
      "shell": "sidebar-main",
      "archetype": "user-dashboard"
    },
    "/dashboard/api-keys": {
      "page": "api-keys",
      "shell": "sidebar-main",
      "archetype": "user-dashboard"
    },
    "/dashboard/settings": {
      "page": "settings",
      "shell": "sidebar-main",
      "archetype": "user-dashboard"
    },
    "/dashboard/billing": {
      "page": "billing",
      "shell": "sidebar-main",
      "archetype": "user-dashboard"
    },
    "/dashboard/team": {
      "page": "team",
      "shell": "sidebar-main",
      "archetype": "user-dashboard"
    },
    "/dashboard/governance": {
      "page": "governance",
      "shell": "sidebar-main",
      "archetype": "user-dashboard"
    },
    "/admin/moderation": {
      "page": "moderation-queue",
      "shell": "sidebar-main",
      "archetype": "admin-moderation"
    },
    "/admin/moderation/:id": {
      "page": "moderation-detail",
      "shell": "sidebar-main",
      "archetype": "admin-moderation"
    }
  },
  "navigation": {
    "command_palette": true,
    "hotkeys": [
      {
        "key": "g b",
        "route": "/browse",
        "label": "Browse Registry"
      },
      {
        "key": "g d",
        "route": "/dashboard",
        "label": "Dashboard"
      },
      {
        "key": "g s",
        "route": "/dashboard/settings",
        "label": "Settings"
      }
    ]
  },
  "seo_hints": {
    "schema_org": [
      "WebApplication",
      "SoftwareApplication"
    ],
    "meta_priorities": [
      "description",
      "og:image",
      "twitter:card"
    ]
  },
  "overrides": {},
  "dependencies": {
    "archetypes": {
      "registry-browser": "^1.0.0",
      "user-dashboard": "^1.0.0",
      "content-editor": "^1.0.0",
      "admin-moderation": "^1.0.0",
      "team-management": "^1.0.0",
      "billing-portal": "^1.0.0"
    }
  },
  "suggested_themes": [
    "luminarum",
    "carbon",
    "launchpad",
    "clean"
  ]
}
