{
  "$schema": "https://decantr.ai/schemas/blueprint.v1.json",
  "id": "workbench",
  "version": "1.0.0",
  "decantr_compat": ">=0.10.0",
  "name": "Workbench",
  "description": "Interactive design-system and API workbench. 7-layer navigation with registry-driven content, global search, live theming controls, and viewport simulation.",
  "tags": [],
  "compose": [
    "workbench"
  ],
  "theme": {
    "id": "auradecantism"
  },
  "personality": "Technical design-system workbench for power users. Dense, IDE-like layout with multi-panel navigation. Monospace typography for code and data, system sans-serif for UI chrome. Dark theme primary with light option. Component previews render in isolated viewports with device simulation. Search is instant and filterable. The aesthetic is VS Code meets Storybook — functional, fast, and keyboard-driven.",
  "voice": {
    "tone": "Technical and precise. Speaks to designers and developers who know design systems. Uses correct terminology.",
    "cta_verbs": [
      "Preview",
      "Inspect",
      "Copy",
      "Search",
      "Configure",
      "Toggle"
    ],
    "avoid": [
      "Submit",
      "Click here",
      "Please enter",
      "Buy",
      "Subscribe"
    ],
    "empty_states": "Technical and helpful. An empty component list should explain how to register components or link to documentation.",
    "errors": "Developer-friendly. Show error codes, stack traces for component render failures, and link to relevant docs.",
    "loading": "Code skeleton blocks with line-height placeholders. Component preview areas show a subtle grid pattern while loading."
  },
  "overrides": {},
  "dependencies": {
    "archetypes": {
      "workbench": "^1.0.0"
    }
  },
  "routes": {
    "/workspace": {
      "shell": "sidebar-main",
      "archetype": "workbench",
      "page": "workspace"
    },
    "/files": {
      "shell": "sidebar-main",
      "archetype": "workbench",
      "page": "files"
    },
    "/terminal": {
      "shell": "sidebar-main",
      "archetype": "workbench",
      "page": "terminal"
    },
    "/settings": {
      "shell": "sidebar-main",
      "archetype": "workbench",
      "page": "settings"
    }
  },
  "navigation": {
    "command_palette": true,
    "hotkeys": [
      {
        "key": "g w",
        "route": "/workspace",
        "label": "Go to Workspace"
      },
      {
        "key": "g f",
        "route": "/files",
        "label": "Go to Files"
      },
      {
        "key": "g t",
        "route": "/terminal",
        "label": "Go to Terminal"
      }
    ]
  },
  "seo_hints": {
    "schema_org": [
      "WebApplication",
      "SoftwareApplication"
    ],
    "meta_priorities": [
      "description",
      "og:title",
      "og:description"
    ]
  }
}
